{"schema_version":1,"id":"dgt:18811074","situation_id":"2816645","source":"dgt","source_version":"3","type":"roadworks","subtype_raw":"roadworks","severity":"unknown","status":"active","road":"N-400","direction":"both","direction_bearing":"unknown","pk":{"from":37.1,"to":37.3},"location":{"start":{"lat":39.993732,"lon":-3.6074991},"end":{"lat":39.994446,"lon":-3.6054852},"province":"Toledo","municipality":"Ontígola"},"lanes_affected":["allLanesCompleteCarriageway"],"start_time":"2025-12-12T07:05:19Z","end_time":null,"raw_description":null,"updated_at":"2025-12-12T07:11:34Z"}
